{
  "$schema": "https://json-schema.org/draft/2020-12/schema",
  "$id": "runtime/schemas/task.schema.json",
  "title": "Task",
  "type": "object",
  "required": ["taskId", "title", "type", "source", "owner", "status", "createdAt"],
  "properties": {
    "taskId": { "type": "string", "minLength": 1 },
    "title": { "type": "string", "minLength": 1 },
    "type": {
      "type": "string",
      "enum": ["chat_or_query", "simple_development", "complex_development", "ops_or_deployment", "skill_maintenance", "agent_maintenance", "review_or_signoff", "parallel_research"]
    },
    "source": {
      "type": "object",
      "required": ["kind"],
      "properties": {
        "kind": { "type": "string", "enum": ["user_message", "heartbeat", "workflow", "manual", "external_event"] },
        "ref": { "type": "string" }
      },
      "additionalProperties": false
    },
    "owner": { "type": "string" },
    "requestedBy": { "type": "string" },
    "status": { "type": "string", "enum": ["new", "routed", "in_progress", "blocked", "review", "done", "failed", "archived"] },
    "complexity": { "type": "string", "enum": ["light", "normal", "complex"] },
    "route": {
      "type": "object",
      "properties": {
        "targetAgent": { "type": "string" },
        "runtime": { "type": "string", "enum": ["native", "acp"] },
        "reason": { "type": "array", "items": { "type": "string" } }
      },
      "additionalProperties": false
    },
    "artifacts": { "type": "array", "items": { "type": "string" } },
    "createdAt": { "type": "string", "format": "date-time" },
    "updatedAt": { "type": "string", "format": "date-time" }
  },
  "additionalProperties": false
}
